{
  "$schema": "https://aitool.watch/schemas/agents-schema.json",
  "schema_version": "1.0",
  "name": "ai-tool-watch",
  "display_name": "AI Tool Watch",
  "description": "A structured, version-controlled reference tracking 18 AI capabilities across 7 products with 87 implementations. Every claim carries its primary source and last-verified date.",
  "url": "https://aitool.watch/",
  "repository": "https://github.com/snapsynapse/ai-tool-watch",
  "license": "MIT",
  "maintainer": "Snap Synapse LLC",
  "generated": "2026-10-25T01:54:44.471Z",
  "capabilities": {
    "read": true,
    "write": false,
    "search": true,
    "compare": true,
    "description": "Read-only access to AI capability, product, and implementation data with search and comparison support."
  },
  "data_freshness": {
    "update_frequency": "twice_weekly",
    "verification_method": "Multi-model cascade (Gemini, Perplexity, Grok, Claude)",
    "freshness_fields": [
      "verified",
      "checked",
      "launched"
    ],
    "cache_ttl_hours": 24
  },
  "api": {
    "base_url": "https://aitool.watch/api/v1/",
    "format": "JSON",
    "authentication": "none",
    "rate_limit": "advisory: 1 request per second",
    "stability": "Paths and field names are stable within v1. New fields may be added.",
    "endpoints": [
      {
        "path": "index.json",
        "description": "API manifest with all available file paths and counts"
      },
      {
        "path": "capabilities.json",
        "description": "All capabilities with search terms, definitions, and cross-links"
      },
      {
        "path": "products.json",
        "description": "All products with provider links and implementation lists"
      },
      {
        "path": "implementations.json",
        "description": "All implementations with plan/surface availability and evidence"
      },
      {
        "path": "providers.json",
        "description": "All providers with logos, websites, and product lists"
      },
      {
        "path": "model-access.json",
        "description": "Archived open-model records, frozen 2026-10-11 and not refreshed"
      },
      {
        "path": "archive.json",
        "description": "Records frozen 2026-10-11: self-hosted runtimes, open-model access, and their providers"
      },
      {
        "path": "evidence.json",
        "description": "Evidence records with sources, changelog, and verification dates"
      },
      {
        "path": "capability-matrix.json",
        "description": "Capability x product availability grid with best-gating per cell"
      },
      {
        "path": "product-comparisons.json",
        "description": "Pairwise product capability overlap for all hosted product pairs"
      },
      {
        "path": "plan-entitlements.json",
        "description": "Per-product breakdown of what each subscription plan unlocks"
      }
    ]
  },
  "mcp": {
    "transport": "stdio",
    "server_script": "scripts/mcp-server.js",
    "protocol_versions": [
      "2026-07-28",
      "2024-11-05"
    ],
    "tools_count": 15,
    "description": "Read-only MCP server with 15 tools for querying capabilities, products, implementations, and evidence.",
    "tools": [
      {
        "name": "list_capabilities",
        "description": "List all capabilities with IDs, names, and groups"
      },
      {
        "name": "get_capability",
        "description": "Full details for a capability by ID"
      },
      {
        "name": "list_products",
        "description": "List active hosted products"
      },
      {
        "name": "get_product",
        "description": "Full details for a product including plan names"
      },
      {
        "name": "compare_products",
        "description": "Pairwise capability overlap between two products"
      },
      {
        "name": "check_availability",
        "description": "Whether a product implements a capability, with gating and plan details"
      },
      {
        "name": "search",
        "description": "Keyword search across capabilities, products, implementations, and models"
      },
      {
        "name": "get_plan",
        "description": "Capabilities and implementations included in a specific product plan"
      },
      {
        "name": "list_providers",
        "description": "All providers with websites, status pages, and product lists"
      },
      {
        "name": "get_provider",
        "description": "Full details for a provider by ID"
      },
      {
        "name": "find_products_by_capabilities",
        "description": "Find products supporting ALL specified capabilities"
      },
      {
        "name": "get_evidence",
        "description": "Verification sources, changelog, and freshness dates for an implementation"
      },
      {
        "name": "list_model_access",
        "description": "Archived open-model records, frozen 2026-10-11 and not refreshed"
      },
      {
        "name": "get_model_access",
        "description": "Full details for an archived open-model record by ID (frozen 2026-10-11)"
      },
      {
        "name": "get_staleness_report",
        "description": "Evidence records whose verified date exceeds a threshold"
      }
    ]
  },
  "discovery": {
    "llms_txt": "https://aitool.watch/llms.txt",
    "robots_txt": "https://aitool.watch/robots.txt",
    "sitemap": "https://aitool.watch/sitemap.xml",
    "rss_feed": "https://aitool.watch/index.xml",
    "agents_json": "https://aitool.watch/agents.json"
  }
}
